{
  "$schema": "https://anthropic.com/claude-code/marketplace.schema.json",
  "name": "stuffbucket-skills",
  "description": "Agent skills and stuffbucket MCP server for Claude, Copilot, and other AI assistants",
  "owner": {
    "name": "Stuffbucket",
    "email": "contact@stuffbucket.co"
  },
  "plugins": [
    {
      "name": "stuffbucket",
      "description": "Agent skills and stuffbucket MCP server",
      "version": "0.2.12",
      "author": {
        "name": "Stuffbucket",
        "email": "contact@stuffbucket.co"
      },
      "source": "./plugins/stuffbucket",
      "category": "development",
      "strict": false,
      "homepage": "https://github.com/stuffbucket/skills"
    }
  ]
}
